{
  "accepted_state_claim": false,
  "blocked_findings": [],
  "file_moves_performed": false,
  "generated_at": "2026-05-14T17:35:40+00:00",
  "index_path": "Needs_Routed/indexes/NEEDS_ROUTED_INDEX.json",
  "items": [
    {
      "artifact_kind": "markdown_workpacket",
      "confidence": 0.82,
      "item_id": "needs_6120a5327d31_ion_consolidation_plan",
      "moved_to": null,
      "original_path": "Needs_Routed/ION consolidation plan.md",
      "queue_proposal": {
        "objective": "Review and route this Needs_Routed artifact under ION candidate-state boundaries. Do not apply, stage, commit, push, or mutate active queues without a later explicit packet.",
        "packet_id": "PCKT-ION-NEEDS-ROUTED-NEEDS_6120A5327D31_ION_CONSOLIDATION_PLAN",
        "proposal_only": true,
        "queue_mutation_performed": false,
        "source_artifact_path": "Needs_Routed/ION consolidation plan.md",
        "work_class": "queue_codex_workpacket"
      },
      "reasons": [
        "artifact_kind:markdown_workpacket",
        "name_or_text_matches_workpacket_lane",
        "legacy_or_source_lane_backlog_not_moved_by_default"
      ],
      "route_class": "queue_codex_workpacket",
      "sha256": "6120a5327d315326c4357fa381de75d044c52487cb72e5fe5e8fc20fbd4565d2",
      "size_bytes": 37593,
      "source_scope": "root",
      "status": "review_only_not_moved",
      "target_path": null
    },
    {
      "artifact_kind": "bundle_zip",
      "confidence": 0.55,
      "item_id": "needs_de78049fb75c_ion_aimos_wisdomnet_living_encyclopedia_integrat",
      "moved_to": null,
      "original_path": "Needs_Routed/ION_AIMOS_WISDOMNET_LIVING_ENCYCLOPEDIA_INTEGRATION_001.zip",
      "queue_proposal": null,
      "reasons": [
        "artifact_kind:bundle_zip",
        "opaque_bundle_requires_owner_review",
        "legacy_or_source_lane_backlog_not_moved_by_default"
      ],
      "route_class": "owner_review_required",
      "sha256": "de78049fb75c14ba717aa827c64f61cd0262dc7de8e7fb323173b98e50a57a84",
      "size_bytes": 10276,
      "source_scope": "root",
      "status": "review_only_not_moved",
      "target_path": null
    },
    {
      "artifact_kind": "bundle_zip",
      "confidence": 0.88,
      "item_id": "needs_18a0022192ee_ion_ai_git_branch_containment_protocol_v0_1_pack",
      "moved_to": null,
      "original_path": "Needs_Routed/ION_AI_GIT_BRANCH_CONTAINMENT_PROTOCOL_V0_1_PACKAGE_20260514T170232Z.zip",
      "queue_proposal": {
        "objective": "Review and route this Needs_Routed artifact under ION candidate-state boundaries. Do not apply, stage, commit, push, or mutate active queues without a later explicit packet.",
        "packet_id": "PCKT-ION-NEEDS-ROUTED-NEEDS_18A0022192EE_ION_AI_GIT_BRANCH_CONTAINMENT_PROTOCOL_V0_1_PACK",
        "proposal_only": true,
        "queue_mutation_performed": false,
        "source_artifact_path": "Needs_Routed/ION_AI_GIT_BRANCH_CONTAINMENT_PROTOCOL_V0_1_PACKAGE_20260514T170232Z.zip",
        "work_class": "branch_context_package_review"
      },
      "reasons": [
        "artifact_kind:bundle_zip",
        "name_or_text_matches_branch_context_lane",
        "legacy_or_source_lane_backlog_not_moved_by_default"
      ],
      "route_class": "branch_context_package_review",
      "sha256": "18a0022192eeac167b07d93fbfb67a7ecd0ba0fe03f281ec91612a83a0b53da9",
      "size_bytes": 21592,
      "source_scope": "root",
      "status": "review_only_not_moved",
      "target_path": null
    },
    {
      "artifact_kind": "markdown_workpacket",
      "confidence": 0.84,
      "item_id": "needs_5184f84e9cfe_ion_boot_sequence_instruction_patch_20260513",
      "moved_to": null,
      "original_path": "Needs_Routed/ION_BOOT_SEQUENCE_INSTRUCTION_PATCH_20260513.md",
      "queue_proposal": {
        "objective": "Review and route this Needs_Routed artifact under ION candidate-state boundaries. Do not apply, stage, commit, push, or mutate active queues without a later explicit packet.",
        "packet_id": "PCKT-ION-NEEDS-ROUTED-NEEDS_5184F84E9CFE_ION_BOOT_SEQUENCE_INSTRUCTION_PATCH_20260513",
        "proposal_only": true,
        "queue_mutation_performed": false,
        "source_artifact_path": "Needs_Routed/ION_BOOT_SEQUENCE_INSTRUCTION_PATCH_20260513.md",
        "work_class": "context_package_ingest"
      },
      "reasons": [
        "artifact_kind:markdown_workpacket",
        "name_or_text_matches_context_package_lane",
        "legacy_or_source_lane_backlog_not_moved_by_default"
      ],
      "route_class": "context_package_ingest",
      "sha256": "5184f84e9cfedc3c9d99c18afb6a664238f424ed778ee3e1e8f3990cbfbcd400",
      "size_bytes": 7926,
      "source_scope": "root",
      "status": "review_only_not_moved",
      "target_path": null
    },
    {
      "artifact_kind": "bundle_zip",
      "confidence": 0.88,
      "item_id": "needs_1328112a3d30_ion_branch_delegation_router_protocol_v0_1_packa",
      "moved_to": null,
      "original_path": "Needs_Routed/ION_BRANCH_DELEGATION_ROUTER_PROTOCOL_V0_1_PACKAGE_20260514T164330Z.zip",
      "queue_proposal": {
        "objective": "Review and route this Needs_Routed artifact under ION candidate-state boundaries. Do not apply, stage, commit, push, or mutate active queues without a later explicit packet.",
        "packet_id": "PCKT-ION-NEEDS-ROUTED-NEEDS_1328112A3D30_ION_BRANCH_DELEGATION_ROUTER_PROTOCOL_V0_1_PACKA",
        "proposal_only": true,
        "queue_mutation_performed": false,
        "source_artifact_path": "Needs_Routed/ION_BRANCH_DELEGATION_ROUTER_PROTOCOL_V0_1_PACKAGE_20260514T164330Z.zip",
        "work_class": "branch_context_package_review"
      },
      "reasons": [
        "artifact_kind:bundle_zip",
        "name_or_text_matches_branch_context_lane",
        "legacy_or_source_lane_backlog_not_moved_by_default"
      ],
      "route_class": "branch_context_package_review",
      "sha256": "1328112a3d302b5c7a13e50b30cc703357c62bfcae0b40bfacd924385098d918",
      "size_bytes": 29208,
      "source_scope": "root",
      "status": "review_only_not_moved",
      "target_path": null
    },
    {
      "artifact_kind": "yaml_packet",
      "confidence": 0.88,
      "item_id": "needs_e880467e3dba_ion_browser_extension_tag_contract_20260514t0324",
      "moved_to": null,
      "original_path": "Needs_Routed/ION_BROWSER_EXTENSION_TAG_CONTRACT_20260514T032414Z.yaml",
      "queue_proposal": {
        "objective": "Review and route this Needs_Routed artifact under ION candidate-state boundaries. Do not apply, stage, commit, push, or mutate active queues without a later explicit packet.",
        "packet_id": "PCKT-ION-NEEDS-ROUTED-NEEDS_E880467E3DBA_ION_BROWSER_EXTENSION_TAG_CONTRACT_20260514T0324",
        "proposal_only": true,
        "queue_mutation_performed": false,
        "source_artifact_path": "Needs_Routed/ION_BROWSER_EXTENSION_TAG_CONTRACT_20260514T032414Z.yaml",
        "work_class": "browser_extension_package_review"
      },
      "reasons": [
        "artifact_kind:yaml_packet",
        "name_or_text_matches_browser_extension_lane",
        "legacy_or_source_lane_backlog_not_moved_by_default"
      ],
      "route_class": "browser_extension_package_review",
      "sha256": "e880467e3dba62c87aac929cdd37bce43c6dc83419a9a773ab983557544dd605",
      "size_bytes": 18151,
      "source_scope": "root",
      "status": "review_only_not_moved",
      "target_path": null
    },
    {
      "artifact_kind": "bundle_zip",
      "confidence": 0.88,
      "item_id": "needs_2cbea18a6d8a_ion_chatops_bridge_tag_receipt_patch_20260514t03",
      "moved_to": null,
      "original_path": "Needs_Routed/ION_CHATOPS_BRIDGE_TAG_RECEIPT_PATCH_20260514T033837Z.zip",
      "queue_proposal": {
        "objective": "Review and route this Needs_Routed artifact under ION candidate-state boundaries. Do not apply, stage, commit, push, or mutate active queues without a later explicit packet.",
        "packet_id": "PCKT-ION-NEEDS-ROUTED-NEEDS_2CBEA18A6D8A_ION_CHATOPS_BRIDGE_TAG_RECEIPT_PATCH_20260514T03",
        "proposal_only": true,
        "queue_mutation_performed": false,
        "source_artifact_path": "Needs_Routed/ION_CHATOPS_BRIDGE_TAG_RECEIPT_PATCH_20260514T033837Z.zip",
        "work_class": "browser_extension_package_review"
      },
      "reasons": [
        "artifact_kind:bundle_zip",
        "name_or_text_matches_browser_extension_lane",
        "legacy_or_source_lane_backlog_not_moved_by_default"
      ],
      "route_class": "browser_extension_package_review",
      "sha256": "2cbea18a6d8a35f82946f3beff8ad15a813144d6b158f8d63626c0188010f744",
      "size_bytes": 252031,
      "source_scope": "root",
      "status": "review_only_not_moved",
      "target_path": null
    },
    {
      "artifact_kind": "bundle_zip",
      "confidence": 0.84,
      "item_id": "needs_329d6e1df051_ion_chat_context_package_20260514",
      "moved_to": null,
      "original_path": "Needs_Routed/ION_CHAT_CONTEXT_PACKAGE_20260514.zip",
      "queue_proposal": {
        "objective": "Review and route this Needs_Routed artifact under ION candidate-state boundaries. Do not apply, stage, commit, push, or mutate active queues without a later explicit packet.",
        "packet_id": "PCKT-ION-NEEDS-ROUTED-NEEDS_329D6E1DF051_ION_CHAT_CONTEXT_PACKAGE_20260514",
        "proposal_only": true,
        "queue_mutation_performed": false,
        "source_artifact_path": "Needs_Routed/ION_CHAT_CONTEXT_PACKAGE_20260514.zip",
        "work_class": "context_package_ingest"
      },
      "reasons": [
        "artifact_kind:bundle_zip",
        "name_or_text_matches_context_package_lane",
        "legacy_or_source_lane_backlog_not_moved_by_default"
      ],
      "route_class": "context_package_ingest",
      "sha256": "329d6e1df0517184e3a3037c749630bbc18647b9414ee568f76f7c5438a712fb",
      "size_bytes": 100937,
      "source_scope": "root",
      "status": "review_only_not_moved",
      "target_path": null
    },
    {
      "artifact_kind": "patch",